股票代码,股票名称,买入信号,评分,图表路径
000593,德龙汇能,"KDJ金叉; 放量上涨: 量比1.70, 涨幅6.00%; 突破20日前高",40,results/000593_德龙汇能_analysis.png
000607,华媒控股,RSI值为49.12，处于低位回升阶段; MACD金叉形成,35,results/000607_华媒控股_analysis.png
000620,盈新发展,"MA金叉形成; 放量上涨: 量比1.93, 涨幅10.00%; 突破20日前高",50,results/000620_盈新发展_analysis.png
000632,三木集团,"放量上涨: 量比1.85, 涨幅4.51%; 突破20日前高",30,results/000632_三木集团_analysis.png
000637,茂化实华,"放量上涨: 量比2.69, 涨幅10.00%; 突破20日前高",30,results/000637_茂化实华_analysis.png
000639,西王食品,"MACD金叉形成; KDJ金叉; 放量上涨: 量比1.52, 涨幅2.28%",45,results/000639_西王食品_analysis.png
000659,珠海中富,"KDJ低位金叉; 放量上涨: 量比1.73, 涨幅3.91%",30,results/000659_珠海中富_analysis.png
000665,湖北广电,"KDJ低位金叉; 放量上涨: 量比4.24, 涨幅10.05%",30,results/000665_湖北广电_analysis.png
